### ISSUE TITLE
fd leak with https_port enabled (sockets to :80 in CLOSE_WAIT)

### ISSUE THREAD

**Issue by shasta123** [dresden-elektronik/deconz-rest-plugin#8494]
### Does the issue really belong here?

- [x] I definitively want to report a bug within deCONZ or its REST-API

### Is there already an existing issue for this?

- [x] I have searched the existing issues and there is none for the bug at hand

### Describe the bug

Hi,

After upgrading to 2.32.5 and running deconz with
/usr/bin/deCONZ --platform minimal --http-port=80 --https-port=443 --auto-connect=1 --device...

I noticed the process consuming a significant number of fd, eventually crashing with too many open files.

Running deconz for a couple of minutes I saw >200 sockets from 127.0.0.1:* -> 127.0.0.1:80 hanging in CLOSE_WAIT

Proto Recv-Q Send-Q Local Address           Foreign Address         State       PID/Program name
tcp        1      0 127.0.0.1:44430         127.0.0.1:80            CLOSE_WAIT  363462/deCONZ       
tcp        1      0 127.0.0.1:60954         127.0.0.1:80            CLOSE_WAIT  363462/deCONZ
tcp        1      0 127.0.0.1:57714         127.0.0.1:80            CLOSE_WAIT  363462/deCONZ       
tcp        1      0 127.0.0.1:44444         127.0.0.1:80            CLOSE_WAIT  363462/deCONZ
tcp        1      0 127.0.0.1:58022         127.0.0.1:80            CLOSE_WAIT  363462/deCONZ       
tcp        1      0 127.0.0.1:58184         127.0.0.1:80            CLOSE_WAIT  363462/deCONZ
[...]

It seems deconz itself is connecting to localhost:

1:57:21.656222 IP 127.0.0.1.34180 > 127.0.0.1.80: Flags [SEW], seq 2278738155, win 65495, options [mss 65495,sackOK,TS val 2669637931 ecr 0,nop,wscale 7], length 0
21:57:21.656253 IP 127.0.0.1.80 > 127.0.0.1.34180: Flags [S.E], seq 4205519716, ack 2278738156, win 65483, options [mss 65495,sackOK,TS val 2669637931 ecr 2669637931,nop,wscale 7], length 0
21:57:21.656284 IP 127.0.0.1.34180 > 127.0.0.1.80: Flags [.], ack 1, win 512, options [nop,nop,TS val 2669637931 ecr 2669637931], length 0
21:57:31.282721 IP 127.0.0.1.80 > 127.0.0.1.34176: Flags [F.], seq 1, ack 1, win 512, options [nop,nop,TS val 2669647557 ecr 2669637411], length 0
21:57:31.282817 IP 127.0.0.1.80 > 127.0.0.1.34180: Flags [F.], seq 1, ack 1, win 512, options [nop,nop,TS val 2669647557 ecr 2669637931], length 0
[...]

When I disable HTTPS (just using 443 for ws) it seems to work stable (although this config will trigger the delays with Alexa):

usr/bin/deCONZ --platform minimal --http-port=80 --https-port=0 --ws-port=443 --auto-connect=1

tcp        0      0 0.0.0.0:443             0.0.0.0:*               LISTEN      373263/deCONZ
tcp        0      0 0.0.0.0:80              0.0.0.0:*               LISTEN      373263/deCONZ       
tcp        0      0 xxx.xx.xxx.97:443       192.168.164.251:56942   ESTABLISHED 373263/deCONZ
tcp        0      0 xxx.xx.xxx.97:443       192.168.164.251:56940   ESTABLISHED 373263/deCONZ       
tcp        0      0 xxx.xx.xxx.97:80        xxx.xx.xxx.65:36468     ESTABLISHED 373263/deCONZ
tcp        0      0 xxx.xx.xxx.97:80        xxx.xx.xxx.97:33226     ESTABLISHED 373263/deCONZ       

Cheers,
Michael

### Steps to reproduce the behavior

Specify HTTP+HTTPS Port
Wait for process to fail

### Expected behavior

No dangling sockets

### Environment

- PC
- Debian Trixie 13.3
- deCONZ 2.32.5 
- Device: ConBee II

**Comment by Smanar** [comment]
`--http-port=80 --https-port=443`

And you can try with only https-port ?
With both it seem deconz is using 443 but third app 80 if I have understand ?

**Comment by manup** [comment]
Thanks for the report, I can reproduce this and have an idea what's the cause.
Internally incoming connections are forwarded/proxied and here the the shutdown of a socket seems to be incomplete.

Working on a fix now.

**Comment by manup** [comment]
I've added two fixes to solve the CLOSE_WAIT state problem https://github.com/dresden-elektronik/deconz/commit/fab9a4f9cab11d4975c08ff208f96d60019e2cae and https://github.com/dresden-elektronik/deconz-lib/commit/0167f6b8a2b3e8af24c075c5b5e2dcecfd1c379c

Surprisingly clients hand this differently while curl rejects a self signed certificate (without the -k parameter) but otherwise doesn't abort the handshake and cleanly closes the TCP connection websocat aborts earlier during the SSL handshake.

**Comment by xfirf** [comment]
Thanks for this report. That issue is driving me nuts too. :-)

**Comment by shasta123** [comment]
Hi, I no longer see this issue with v2.33.0-beta. Thanks for your fix

Cheers,
Michael

**Comment by kolorfilm** [comment]
I can confirm.

**Comment by ulik14** [comment]
Glad I found this.  With 2.32.5 I had the exact same problem and  v2.33.0-beta fixed it. Now I can switch lights again.
Thanks a lot for the fix!

Ciao, Uli
