### ISSUE TITLE
Gateway gui freezes frequently behind NAT router

### ISSUE THREAD

**Issue by mspbonn** [dresden-elektronik/deconz-rest-plugin#3941]
## Describe the bug

My deCONZ Gateway gui freezes frequently behind NAT router.

Within the same network no problems occurs. When accessing the gui over NAT from another network it freezes frequently.
On the router you can only see packets sent to the gateway, but no response.

```
21:44:06.224632 IP 192.168.178.1.60194 > 192.168.179.140.80: Flags [.], ack 5937, win 342, options [nop,nop,TS val 54030940 ecr 2015209353], length 0
21:44:06.225021 IP 192.168.178.1.60196 > 192.168.179.140.80: Flags [S], seq 884695822, win 29200, options [mss 1460,sackOK,TS val 54030940 ecr 0,nop,wscale 7], length 0
21:44:06.225979 IP 192.168.178.1.60198 > 192.168.179.140.80: Flags [S], seq 2592054304, win 29200, options [mss 1460,sackOK,TS val 54030941 ecr 0,nop,wscale 7], length 0
21:44:06.226907 IP 192.168.178.1.60194 > 192.168.179.140.80: Flags [P.], seq 571:1142, ack 5937, win 342, options [nop,nop,TS val 54030941 ecr 2015209353], length 571: HTTP: GET /api/486C1CC8E4/config?_=1608151440692 HTTP/1.1
21:44:06.228663 IP 192.168.178.1.60196 > 192.168.179.140.80: Flags [.], ack 716378164, win 229, options [nop,nop,TS val 54030942 ecr 2015209359], length 0
21:44:06.229210 IP 192.168.178.1.60196 > 192.168.179.140.80: Flags [P.], seq 0:571, ack 1, win 229, options [nop,nop,TS val 54030942 ecr 2015209359], length 571: HTTP: GET /api/486C1CC8E4/config?_=1608151440693 HTTP/1.1
21:44:06.229580 IP 192.168.178.1.60198 > 192.168.179.140.80: Flags [.], ack 4266080461, win 229, options [nop,nop,TS val 54030942 ecr 2015209359], length 0
21:44:06.243810 IP 192.168.178.1.60194 > 192.168.179.140.80: Flags [.], ack 8833, win 387, options [nop,nop,TS val 54030945 ecr 2015209372], length 0
21:44:06.244220 IP 192.168.178.1.60194 > 192.168.179.140.80: Flags [.], ack 11873, win 434, options [nop,nop,TS val 54030945 ecr 2015209372], length 0

```

After a while it recovers.

## Steps to reproduce the behavior

Browser behind NAT router permanently opened. After a while the gui does not respond.

## Expected behavior

100% availability.

## Screenshots

![Bildschirmfoto vom 2020-12-17 09-31-34](https://user-images.githubusercontent.com/64546674/102462974-c746de00-404a-11eb-9c20-b40953f998d6.png)

## Environment

 - Host system: Raspberry Pi
 - Running method: Raspbian
 - Firmware version: 26610700
 - deCONZ version: 2.08.00 / 8.12.2020
 - Device:RaspBee II

## deCONZ Logs

None.

## Additional context

None.
